{
  "schemaVersion": "9",
  "scope": "volume",
  "exportedAt": "2026-07-15T00:00:00Z",
  "volume": {
    "volumeId": 1,
    "name": "第一卷",
    "description": "示例卷",
    "order": 1,
    "status": "archived",
    "createdAt": "2026-07-01T00:00:00Z",
    "updatedAt": "2026-07-15T00:00:00Z",
    "sealedAt": "2026-07-10T00:00:00Z",
    "archivedAt": "2026-07-15T00:00:00Z"
  },
  "chapters": [
    {
      "id": "chapter-001",
      "title": "第一章",
      "content": "第一章正文内容……",
      "contentHash": "e3b0c44298fc1c149afbf4c8996fb92427ae41e4649b934ca495991b7852b855",
      "wordCount": 100,
      "status": "approved",
      "createdAt": "2026-07-02T00:00:00Z",
      "updatedAt": "2026-07-03T00:00:00Z"
    }
  ],
  "emergences": [],
  "mainplotNodes": [],
  "threadBindings": [],
  "verdicts": [],
  "ruleChecks": [],
  "warnings": []
}
